openalex_id,pvalue_method,corroboration,feature_heterogeneity,title,doi,evidence
W4390704691,none,,skewed,Toxicity Assessment of Mixed Exposure of Nine Perfluoroalkyl Substances at Concentrations Relevant to Daily Intake,10.3390/toxics12010052,"The paper uses scikit-learn random forest with default impurity-based importance (not specified but standard Gini/MDI for classification). It ranks features explicitly: ""5-aminovaleric acid as the most important compound"" and ""5-(Carbamoylamino)pentanoic acid, which had the second highest contribution in the random forest model."" The authors interpret these rankings biologically: ""The substance that contributed the most to the classification, 5-aminovaleric acid, is known to act as a weak GABA receptor agonist...may be associated with increased gene expression of Chrna4."" No permutation importance, SHAP, PDP/ALE, conditional importance, or held-out validation was performed to corroborate the feature rankings."
W4415614888,none,,scale_mismatch,Groundwater and Remotely Sensed Phenology Reveal Vulnerability of Riparian Trees to Drought,10.1111/gcb.70564,"The paper states: ""we used the 'vivid' package (Inglis et al. 2023) to estimate variable importance and its interaction effects for each predictor"" and concludes: ""photoperiod dominated at the perennial site, while DTW was the controlling factor at intermittent sites"" (Section 3.3). Figure 5 visualizes importance via node size, and the text emphasizes rank: ""photoperiod having the highest importance"" at perennial sites versus ""DTW...dominated"" at intermittent sites. No permutation, SHAP, PDP/ALE, conditional, or held-out validation of these importance rankings is provided; only a sensitivity analysis of model performance confirms precipitation lags offer ""no significant improvement."""
W7164031193,none,none,mixed_types|skewed,Closing the implementation-evidence gap using data science: a transferable workflow applied to medical cost analysis,10.3389/frhs.2026.1742807,"The paper states: ""RF regression with 50 trees and 5-fold cross-validation identified income, activity limitation, age, and chronic conditions as key predictors of medical expenditure"" and ""Across all specifications, chronic conditions consistently emerged as the most important variable of medical expenditure, confirming the stability, robustness, and reliability of the findings."" The main conclusion is: ""Statistical and machine learning analyses of the MEPS consistently identify chronic disease burden as the strongest predictor of total medical expenditure."" This ranking-based interpretation relies entirely on impurity-importance measures from RF/GBR without permutation, SHAP, PDP/ALE, conditional, or held-out importance validation."
W4389977364,none,heldout_validation,skewed,Whole blood RNA sequencing identifies transcriptional differences between primary sclerosing cholangitis and ulcerative colitis,10.1016/j.jhepr.2023.100988,"The paper explicitly uses ""average Gini impurity increase"" importance and ranks genes by it: ""Not only known marker genes, such as S100A12 and S100A9, but also genes encoding ribosomal components and mitochondrial genes (examples including COX6B1, MT-RNR2, RPS9) were among the top 10 most important genes (Table S19)."" For pathway enrichment, ""we used the top 50% cumulated importance genes as input and weighted those by feature importance."" Critically, validation is limited to predictive performance on held-out cohorts; there is no permutation importance, SHAP, or conditional importance analysis to validate the feature ranking itself. The conclusions about which genes distinguish UC from PSC rely substantially on this unvalidated importance ranking."
W4384397967,none,conditional,mixed_types|high_cardinality|skewed,Analysis of Performance and Failure Modes of the IROC Proton Liver Phantom,10.14338/ijpt-22-00043.1,"The paper reports: ""The highest ranking variables of importance for classification and all regression variables were irradiation year and PTV1 and PTV2 extent."" However, univariate analysis contradicts this parity: extent predicts pass rate with R^2=0.71-0.85 (p=0.008-0.003), while year shows R^2=0.30 (p=0.20, non-significant). The ranking that year equals extent in importance is not corroborated by univariate regression. No permutation, SHAP, PDP/ALE, or conditional importance is provided to defend the ranked distinction between variables, leaving the ranking vulnerable to impurity bias magnification."
W4296249018,none,none,mixed_types|skewed|scale_mismatch,Role of intratumoral and peritumoral CT radiomics for the prediction of EGFR gene mutation in primary lung cancer,10.1259/bjr.20220374,"The paper explicitly uses ""mean decrease in the Gini index"" to measure feature importance and ranks features by magnitude: ""The top 10 most important features were eight radiomic features, Brinkman index, and sex... Among the radiomic features, the intratumoral 90th percentile was the most important, followed by peritumoral large area high gray level emphasis (LAHGLE)."" The Discussion interprets these importance rankings to support biological claims, stating ""the most important peritumoral feature for predicting EGFR mutations was LAHGLE, with high values correlating with mutations. This radiomic feature measures the extent of a large area with a high CT value and can be elevated when high-density structures, such as large pulmonary vessels, are present around tumors."" No alternative importance measures (permutation, SHAP, PDP/ALE, conditional, or held-out validation) are provided to corroborate the ranking or magnitudes."
W4415960373,none,none,mixed_types|high_cardinality|scale_mismatch,Predictors of adjustment to life after service among Canadian military veterans,10.1038/s41598-025-22710-y,"The paper uses Gini impurity importance via ranger: ""Node impurity was measured by the Gini index embedded within the R package ranger to determine variable importance."" It interprets magnitude and ranking without corroboration: ""The most important predictor of adjustment to civilian life was life satisfaction"" and ""the top ten most important predictors...in order of importance, were life satisfaction, mastery, mental health, age, BMI, social support, satisfaction with one's main activity, general health, income, and financial satisfaction."" No permutation importance, SHAP, PDP/ALE, conditional importance, or held-out validation is used; multinomial logistic regression tests class differences on selected predictors but does not validate the importance rankings themselves."
W4390875684,none,heldout_validation,high_cardinality|skewed|scale_mismatch,IgG Antibody Responses to Epstein-Barr Virus in Myalgic Encephalomyelitis/Chronic Fatigue Syndrome: Their Effective Potential for Disease Diagnosis and Pathological Antigenic Mimicry,10.3390/medicina60010161,"The paper ranks 3054 EBV peptide antibodies using mean decrease in Gini index and selects features by adding top-ranked antibodies until reaching 85% accuracy, yielding a 26-antibody diagnostic classifier. It interprets magnitude (""overall average antibody importance was around 0.018"" vs. highest at 0.36) and ranking explicitly, stating ""antibodies against this candidate antigen were not among the top most important antibodies for disease prediction,"" using this ranking interpretation to downplay molecular mimicry's pathogenic role. Corroboration is limited to held-out test accuracy (90%), without permutation importance, SHAP, conditional importance, or alternative feature selection methods to verify whether MDI ranking identifies optimal biomarkers or whether magnitude/ranking would persist under different importance measures."
W4387847688,none,,mixed_types,Characterizing Families of Spectral Similarity Scores and Their Use Cases for Gas Chromatography–Mass Spectrometry Small Molecule Identification,10.3390/metabo13101101,"Section 2.4 explicitly states: ""The relative importance of each variable in the random forest model was determined using the Gini Index."" The results section ranks variables by importance: ""Among all variables considered, the computed t-statistics of metrics is definitively the most important in dictating cluster group membership. Since, in this context, the t-statistic measures how different the true positive and non-true-positive distributions are from one another for each metric, the high importance of the t-statistic indicates that the four empirical cluster groups are largely determined by the discriminatory ability of each metric."" No permutation, SHAP, PDP/ALE, or other corroboration is provided for these magnitude and ranking conclusions, which form the paper's core interpretation of feature importance."
W4408884311,none,none,mixed_types|skewed,Modelling microclimatic variability in Andean forests of northern Patagonia,10.1007/s00484-025-02891-x,"The paper explicitly interprets importance magnitude and ranking to identify ""drivers of microclimatic variability"": local macroclimatic data ""exerted the most substantial influence, with its influence ranging from 50 to 80%""; TMIN at station is ranked #1 with 68.3% importance for soil temperature prediction; solar radiation, FAPAR, NDMI emerge as ""key predictors"" based on relative importance percentages. No alternative importance methods (permutation, SHAP, PDP/ALE, conditional) are used to corroborate these rankings."
W4206724638,none,,mixed_types|scale_mismatch,"A multi-step machine learning approach to assess the impact of COVID-19 lockdown on NO2 attributable deaths in Milan and Rome, Italy",10.1186/s12940-021-00825-9,"The paper reports LURF models built with ranger (which uses impurity-based importance by default) and identifies ""most important predictors"" as ""traffic load for light vehicles and heavy and commercial vehicles and roads length"" at specific buffer scales. This ranking is presented without permutation importance, SHAP, PDP/ALE, conditional importance, or held-out importance validation. The importance-based identification of traffic dominance directly supports the paper's policy recommendations for ""more ambitious traffic calming policies,"" making the ranking central to conclusions."
W4412488746,none,none,mixed_types|high_cardinality|skewed,Multivariable machine learning prediction of risky alcohol use in contemporary youth,10.1111/add.70145,"The paper's core aim is to ""identify the most important predictors of risky alcohol use,"" presenting rankings where ""weekly drinking at the previous wave (mean weighted importance 0.999), lifetime cannabis use (0.446), lifetime parent financial stress (0.420)"" lead the list. These impurity-importance rankings directly drive clinical recommendations: ""Using the most important features in SuperLearner to improve prediction of risky alcohol use may enable earlier and more efficient alcohol prevention programs and messaging by targeting resources to those most at risk."" The paper provides no permutation importance, SHAP, PDP/ALE, or conditional importance validation of these magnitudes and rankings, relying instead only on ensemble weighting as corroboration."
W3154410843,none,,mixed_types|high_cardinality,Increased ozone pollution alongside reduced nitrogen dioxide concentrations during Vienna’s first COVID-19 lockdown: Significance for air quality management,10.1016/j.envpol.2021.117153,"The paper uses the ranger R package (via rmweather wrapper) which computes impurity-based importance by default. They report variable importance rankings: ""The most important explanatory variables to predict hourly concentrations of NO2, O3 and Ox in Vienna were monitor dependent. On average, the importance for the NO2 models was given in the following ascending order: ws, wd, thour, tjd, Tair, RH, tweek, ttrend and Patm... the O3 models suggest that RH is, on average, more important than Tair."" They interpret these rankings substantively to understand physical processes: ""The variables' importance agrees well with the chemical and physical processes expected to drive the dynamics of these pollutants, thereby demonstrating the random forest models' interpretability nature... these results on their own could be valuable to help better understand the sensitivity of O3 pollution to meteorology in future studies."" No corroboration via permutation importance, SHAP, conditional importance, PDP/ALE, or held-out validation is provided."
W4206200000,none,none,mixed_types,Prediction of Physical Frailty in Orthogeriatric Patients Using Sensor Insole–Based Gait Analysis and Machine Learning Algorithms: Cross-sectional Study,10.2196/32724,"Methods state ""Gini impurity was used to rank the variables in order of their importance."" Results report ""The number of steps and the step length were the most decisive factors...The gait speed followed in third place."" Discussion concludes ""the advanced modeling used in this study weighted stride length equally important as gait speed...in terms of their classification importance measured by the Gini impurity"" and recommends ""stride length in addition to gait speed might be a valuable clinical parameter to identify patients with physical frailty."" No permutation, SHAP, PDP/ALE, or conditional importance validation provided."
W4225788860,none,pdp_ale,mixed_types|scale_mismatch|skewed,Multilevel predictors of climate change beliefs in Africa,10.1371/journal.pone.0266387,"The authors rank predictors using corrected Gini importance, declaring that ""worsening perceptions of agricultural conditions are the main predictor for climate change risk perception"" and state ""Local changes in climate conditions are among the most important predictors across all models. Overall, they are more important than access to news, political ideology, or demographics."" While partial dependence plots show conditional direction and magnitude of effects, they do not independently validate the importance ranking itself. The entire narrative rests on interpreting the magnitude and ranking of importance scores without corroboration from permutation importance, SHAP, or other ranking-validating methods."
W4302363433,none,conditional,high_cardinality|skewed,Structural variants identified using non-Mendelian inheritance patterns advance the mechanistic understanding of autism spectrum disorder,10.1016/j.xhgg.2022.100150,"The paper states: ""we used a custom R implementation of iterative random forest (iRF) machine learning to classify the cluster labels... The top ten most important genes for each cluster were extracted based on their Gini importance scores provided by the Ranger v0.12 R package."" The authors then claim specific genes ""define"" each cluster (e.g., ""an ASD-SV in the CTNNA2 gene defines cluster 1""), using the ranking of Gini importance to support precision medicine conclusions. Biological validation via GO enrichment, eQTL overlap, and RNA-seq validates plausibility but does not corroborate the importance ranking itself against permutation importance, SHAP, or other methods."
W4393389721,none,none,mixed_types,Spatial habitat suitability prediction of essential oil wild plants on Indonesia’s degraded lands,10.7717/peerj.17210,"The paper identifies ""three most important variables affecting the habitat suitability"" for each species (Results section, Figure 5), ranking predictors like temperature, precipitation, and soil parameters. These importance rankings are central to restoration recommendations: ""Highly suitable habitats for A. pedunculata...are mostly predicted in degraded lands in Java"" based on variable importance. No permutation importance, SHAP, PDP/ALE, conditional importance, or held-out validation of importance ranks is provided. Only biological explanations for why variables should matter are offered, which does not correct for impurity bias magnifying effects on skewed features or confounding interactions with the named variables."
W4321436530,none,none,mixed_types|high_cardinality|skewed|scale_mismatch,Kinome inhibition states and multiomics data enable prediction of cell viability in diverse cancer types,10.1371/journal.pcbi.1010888,"Abstract states ""we identified a set of kinases, several of which are understudied, that are strongly influential in the cell viability prediction models."" Results section: ""We next built the final random forest model with the full data set and collected variable importance metrics for each of the included features...the model also identifies several understudied kinases, CSNK2A2, PIP4K2C, CAMKK2 and DYRK1B, as being influential."" Experimental validation (Fig 6) tests overall model predictions on held-out data but does not corroborate individual feature importances through permutation importance, SHAP, or conditional methods. Features span heterogeneous scales and cardinalities without importance-ranking corroboration."
W4313511865,none,none,mixed_types|skewed,Predicting academic success of autistic students in higher education,10.1177/13623613221146439,"The paper states it ""determined the variable importance for each model based on the training set using the packages' built-in methods"" (impurity-based for ranger). The Discussion repeatedly interprets magnitude and ranking: ""the most important predictors"" (parallel program, application timing), ""the order of predictors reverses"" in year 2, and ""the third group of predictors...becomes important."" These rankings drive all mechanistic claims about educational fit, study choice issues, and academic performance. No permutation importance, SHAP, PDP/ALE, or conditional importance validation is mentioned."
W4361286446,none,heldout_validation,mixed_types|skewed,Data-Independent Acquisition Phosphoproteomics of Urinary Extracellular Vesicles Enables Renal Cell Carcinoma Grade Differentiation,10.1016/j.mcpro.2023.100536,"Feature selection used ranger random forest importance to identify ""the top 15 from each comparison"" visualized in ""variable importance plots"" and discussed as key biomarkers. While ""ROC analyses for the top seven phosphosites showed excellent area under the ROC curve (AUC) scores, which were more than 90%"", this validates predictive performance but not the impurity-based ranking itself. The paper concludes with specific phosphosites (TRIM28, NDRG2, SDCBP, etc.) identified via ranger ranking without comparing to alternative importance methods like permutation importance or SHAP."
W4384931586,none,,mixed_types|high_cardinality,"Investigation of the Relationships between Coat Colour, Sex, and Morphological Characteristics in Donkeys Using Data Mining Algorithms",10.3390/ani13142366,"The RF results section states: ""In the constructed model, the most significant factor affecting body length was province, withers height (WH), followed by HR and HL, respectively (Table 3 and Figure 4)"" using Inc Node Purity (impurity importance) values without p-value testing. The conclusion explicitly ranks variables by impurity importance: ""In order of importance, the variables affecting the body length in donkeys were Province, WH, and HR for the RF Algorithm."" No corroboration methods (permutation, SHAP, PDP/ALE, conditional importance) are applied. Features are mixed (11 continuous morphological traits + categorical Province with 13 levels, Sex with 2 levels, Coat colour with 4 levels). High correlations exist among predictors (WH-HR: 0.951, WH-HL: 0.783), creating conditions for unstable importance rankings and bias toward high-cardinality categorical variables."
W4360808845,none,,mixed_types|high_cardinality|skewed|scale_mismatch,Aberrations in the early pregnancy serum metabolic profile in women with prediabetes at two years postpartum,10.1007/s11306-023-01994-z,"The paper reports: ""The following five serum metabolites and covariates were the most important features in the classifier; glycerol, cholesterol esters to total lipids ratio in very large HDL particles, acetoacetate, free cholesterol to total lipids ratio in large HDL and age."" It then states ""In our model, glycerol was the most important predictor"" and uses these importance rankings to drive biological interpretation without corroboration. No permutation importance, SHAP, PDP/ALE, conditional importance, or held-out validation of rankings is provided."
W4281708676,none,none,skewed|high_cardinality|mixed_types,"Rich cities, poor countryside? Social structure of the poor and poverty risks in urban and rural places in an affluent country",10.1177/02690942221104774,"The paper ranks variables as predictors: 'Our machine-learning based risk factor assessment suggests that the immediate social situation, such as not having access to gainful employment and the sector of occupation, are the most dominant factors predicting poverty...Overall, the social situation variables outperform the characteristics that describe social groups...Finally, all characteristics that relate to the opportunity structure have lower predictive power compared to the social situation and social groups.' This ranking conclusion drives policy recommendations for urban vs. rural interventions, yet lacks corroboration by permutation, SHAP, PDP/ALE, or conditional methods. Opportunity-structure variables (political leaning 61.6% vs 8.6%, language 94.8% vs 5.2%) are highly skewed, vulnerable to impurity underweighting; sector of occupation gains importance in full model due to interactions, a known impurity bias signature."
W4408246350,none,pdp_ale|heldout_validation,mixed_types|skewed|scale_mismatch,Encouraging native predators of invasive yellow‐legged hornets: breeding habitat preferences of European honey buzzards in exotic <scp><i>Eucalyptus</i></scp> plantations,10.1002/ps.8738,"The paper explicitly uses 'mean decrease in node impurity, using the Gini index as the splitting rule.' It reports specific rankings: intraspecific NND as '7th most important predictor', interspecific interactions as '14th, 16th and 26th most important predictors,' and groups factors into 'primary' (7 factors) and 'secondary' (10 factors) groups. The main conclusions lean on these rankings: 'Vegetation and topographic features (first-order factors) were the primary ecological drivers...Secondary factors included intraspecific interactions...third-order factors were relatively less influential.' While PDPs and test-set validation (F1=87.5%, Accuracy=85%) are provided, these do not independently corroborate importance RANKINGS—they show model performance and marginal effects but not whether Gini rankings correctly reflect relative variable importance. No permutation importance, SHAP, or conditional importance analysis validates the rankings."
W2588003345,none,none,mixed_types|high_cardinality,SoilGrids250m: Global gridded soil information based on machine learning,10.1371/journal.pone.0169748,"The paper displays ""Fitted variable importance plots"" (Figure 6) from ranger and xgboost and makes substantive claims about magnitude and ranking: ""spatial pattern of soil pH is primarily influenced by precipitation and surface reflectance,"" ""depth emerges as the most important covariate,"" and ""DEM-parameters...emerge as second-most dominant covariates."" No permutation importance, SHAP, PDP/ALE, conditional importance, or Boruta analysis is mentioned. Figure 7 shows individual scatter plots but not systematic corroboration. Expert knowledge validation (""largely correspond with conventional soil survey knowledge"") is mentioned but does not qualify as statistical corroboration."
W2741922227,none,none,mixed_types|skewed,Soil nutrient maps of Sub-Saharan Africa: assessment of soil nutrient content at 250 m spatial resolution using machine learning,10.1007/s10705-017-9870-x,"The paper states: ""The variable importance plot (Fig. 11) further shows that the most influential predictors of the crop yield are: crop type, selection of nutrients and micro-nutrients (Mn, Zn, Al, B, Na)...This proves that producing maps of soil nutrients is indeed valuable for modeling agricultural productivity."" For individual nutrients, they claim ""soil pH is clearly most important covariate for Na, K, Ca, Mg, Al"" and ""Precipitation distinctly comes as the most important covariate overall"" based entirely on ranger importance rankings reported in Table 2. The paper acknowledges post-hoc: ""although some micro-nutrients such as Mn and Zn come highest on the variable importance list, this does not necessarily makes them the most important nutrients in Africa...because soil nutrients are heavily cross-correlated relatively high importance of Mn and Zn could also indicate high importance of P, B, Fe and/or S."""
W3173126360,none,heldout_validation,high_cardinality|skewed,RaFAH: Host prediction for viruses of Bacteria and Archaea based on protein content,10.1016/j.patter.2021.100274,"The paper states it ""applied importance analysis to determine which protein clusters were most relevant for predicting viral hosts"" and uses the ranking to identify the ""most important predictor"" and ""50 most important proteins,"" arguing these findings prove ""RaFAH learned to predict virus-host associations based on proteins that are directly involved in virus-host molecular interactions."" While the paper validates model performance on held-out test sets and notes these proteins are biologically known to determine host range, it lacks permutation importance, SHAP, PDP/ALE, or conditional importance analysis to validate whether the impurity-importance ranking itself is accurate."
