openalex_id,pvalue_method,corroboration,feature_heterogeneity,title,doi,evidence
W3168219035,none,conditional,mixed_types|high_cardinality|skewed|scale_mismatch,Biological knowledge-slanted random forest approach for the classification of calcified aortic valve stenosis,10.1186/s13040-021-00269-4,"The paper uses selection frequency across trees to rank genes and identifies ATP6V0D2 as the ""main gene used to classify the cases"" and reports ""the 20 top genes."" The substantive claim is that ""knowledge-slanted RF could be more easily interpreted by users because the prediction can be attributed mainly to associated genes."" However, ranking is validated only via post-hoc univariate ANOVA on differential expression (conditional on prior selection), not via permutation importance, SHAP, PDP/ALE, or held-out validation of classification importance."
W4307429571,none,pdp_ale,mixed_types|high_cardinality|skewed|scale_mismatch,Predicting Clinical Remission of Chronic Urticaria Using Random Survival Forests: Machine Learning Applied to Real-World Data,10.1007/s13555-022-00827-6,"The paper uses ranger random survival forests and identifies features as ""among the 20 most important predictors"" and ""among the 50 most important predictors,"" ranking them by impurity-based importance. Key claim: ""Clinically relevant features identified by the model to have the most predictive value for the time to clinical remission included age at index, time from first recorded CU-related symptom to first CU diagnosis, BMI, smoking status, asthma, allergic rhinitis, chronic pulmonary disease, and prior medication use."" Only one variable (age) receives partial dependence validation shown in supplementary materials; other top-ranked categorical and binary comorbidity variables lack corroboration. Discussion emphasizes these identified predictors as central to understanding disease pathogenesis: ""The potential for the characteristics identified as important by the predictive model, such as comorbidities, polypharmacy, and increased laboratory workup, to help predict time to clinical remission raise intriguing questions regarding the pathogenesis of CU."""
W3137588420,none,none,mixed_types|high_cardinality|skewed,A first-generation pediatric cancer dependency map,10.1038/s41588-021-00819-w,"The paper identifies ""the most important feature in predicting MCL1 dependency was BCL2L1 expression"" and ""the top predictive feature for MDM2 dependency was RNA expression of EDA2R, a known direct target of p53"" and ""Predictive feature modeling for HDAC2 highlighted RNA expression of its known target FUCA1."" These ranking-based feature importance statements are used to make biological inferences, but the Methods section provides no description of how importance was calculated (scikit-learn default is Gini/MDI). No permutation importance, SHAP, PDP/ALE, conditional importance, or other robust validation of the feature importance rankings is reported; bivariate correlations shown (Fig 8b) do not validate the multivariate feature importance ranking."
W4385241282,none,pdp_ale|conditional,scale_mismatch,Analysis of the Frictional Performance of AW-5251 Aluminium Alloy Sheets Using the Random Forest Machine Learning Algorithm and Multilayer Perceptron,10.3390/ma16155207,"The paper ranks variables by ""mean decrease in accuracy,"" concluding oil viscosity (0.59) is far more important than Ra (0.30) or K/Rp0.2 (0.05-0.06). These magnitude and ranking claims are central to conclusions like ""K and the other inputs...was the least important one."" ALE plots and ANNs provide partial corroboration that viscosity and Ra drive friction, but permutation importance, SHAP, or held-out predictive validation are absent. Feature scales range over orders of magnitude (Ra: 0.3-1.25 µm; viscosity: 14-44 mm²/s; Rp0.2: 68-212 MPa; K: 242-370 MPa), creating conditions where impurity importance can magnify apparent effect size differences."
W4400414696,none,heldout_validation,mixed_types,"Predicting Response to Neuromodulators or Prokinetics in Patients With Suspected Gastroparesis Using Machine Learning: The “BMI, Infectious Prodrome, Delayed GES, and No Diabetes” Model",10.14309/ctg.0000000000000743,"The paper uses the R package vip to extract variable importance from a ranger random forest model without specifying the importance type, defaulting to impurity-based (Gini) importance. The authors explicitly rank variables by importance magnitude: ""Delayed GES was the most important predictor by variable importance analysis, followed by absence of diabetes, BMI, and infectious prodrome"" and state clinical conclusions directly tied to these rankings such as ""increase in BMI was predictive of response"" while ""delayed GES, absence of diabetes, and infectious prodrome were predictors of nonresponse."" They validate on a held-out test set but provide no permutation importance, SHAP, PDP/ALE, or conditional importance corroboration of the variable rankings."
W7125958004,none,conditional,high_cardinality|scale_mismatch,Applying traditional and machine learning-based GWAS approaches for marker-trait identification in wheat,10.3389/fpls.2025.1734247,"The paper explicitly uses ""decrease of node impurity"" for Random Forest and ""gain"" for XGBoost. Methods section states: ""As feature importance metrics, we selected gain for XGB and decrease of node impurity for RF instead of permutation-based importance."" The results interpret magnitude and ranking: ""RF model identified 44 highly important markers, with major loci on chromosomes 6A and 6D"" and ""XGB algorithm highlighted highly important loci."" While MTAs are cross-validated across traditional and ML methods, this validation addresses which variables are selected (yes/no), not whether the magnitude and ranking of impurity importance is correct. No permutation importance, SHAP, PDP/ALE, or conditional importance validation is provided."
W2980013674,none,permutation,mixed_types|high_cardinality,Use of QSAR Global Models and Molecular Docking for Developing New Inhibitors of c-src Tyrosine Kinase,10.3390/ijms21010019,"The paper uses RF-based impurity importance from three separate algorithms (randomForest, randomForestSRC, ranger packages) for feature selection. The Discussion prominently ranks features by importance: ""By far the most important descriptor in our work, identified by multiple feature selection algorithms, was SpMax4_Bh(m)"" and ""The second most important descriptor for our data set was DECC."" The Results section emphasizes that ""the first five [descriptors] explained the largest part of the variability in the training and testing datasets."" The features are heterogeneous across 19 descriptor types (1596 features for 2D atom pairs alone) with mixed numerical scales. While the paper used permutation importance as one of 17 selection algorithms and external model validation (docking, PubChem/ChEMBL), it does not validate the RANKING or MAGNITUDE of feature importance via permutation-based or SHAP methods to confirm the RF-based importance rankings hold robustly."
W3162810055,none,pdp_ale,mixed_types|high_cardinality|skewed|scale_mismatch,Spring phenology drives range shifts in a migratory Arctic ungulate with key implications for the future,10.1111/gcb.15682,"The paper explicitly uses ""improvement in Gini impurity"" for variable selection and importance calculation. Figure 2 ranks phenology variables by importance, claiming ""The most important variable was the proportion of low shrub cover at the 10-km scale followed by snow melt and onset of greenness dates."" The core finding that caribou are driven by specific phenological windows relies on these importance rankings without permutation or SHAP corroboration. The paper makes no mention of p-values for importance statistics and uses only partial dependence plots as supplementary visualization of variable relationships."
W7153345606,none,shap|none,mixed_types|high_cardinality|skewed,Interpretable multi-omics machine learning reveals drought-driven shifts in plant-microbe interactions,10.1186/s40793-026-00883-x,"The paper states ""RF constructs a collection of decision trees and aggregates their predictions, providing both high predictive performance and feature importance scores for biological features"" and explicitly interprets feature ranking: ""Under drought stress, the most highly contributing features were predominantly flavonoids, including isoflavones (e.g. daidzin and its derivatives and genistin)."" The abstract concludes that ""SHAP indicated that the isoflavone derivative, daidzin, and the drought-tolerant Candidatus Nitrosocosmicus, were major contributors to phenotypic variation."" The paper uses SHAP for post-hoc interpretation of an RF importance-ranked model, not permutation importance or other magnitude-corroborating methods prior to drawing conclusions about feature ranking and magnitude."
W3202758959,none,none,mixed_types|skewed|scale_mismatch,"Not just form, not just meaning: Words with consistent form-meaning mappings are learned earlier",10.1177/17470218211053472,"The paper uses Random Forest regression via ranger package and states ""the importance of a variable to the regression task can be easily computed and provides insights about its role in predicting the target variable,"" then interprets magnitude and ranking: ""PSC ld, in particular, is slightly more important than concreteness and more important than most other predictors"" and ""PSC ld is more important than iconicity in predicting AoA and ranks just below concreteness."" Features include binary morphological complexity, continuous measures, and count-based predictors (PND, frequency) that are typically right-skewed. No permutation importance, SHAP, PDP/ALE, conditional importance, or held-out test validation is used; corroboration relies on linear regression (validating significance/direction, not importance magnitude) and GAMs (validating non-linearity check), neither of which address impurity importance bias to magnitude and ranking."
W4412446983,none,permutation|heldout_validation,mixed_types|skewed|scale_mismatch,Random forest-based bioavailable strontium isoscape for environmental and archaeological applications in central eastern Argentina and western Uruguay,10.1371/journal.pone.0326047,"The paper reports both Increase in Mean Squared Error (%IncMSE, permutation-based) and Increase in Node Purity (IncNodePurity, impurity-based) importance measures. The authors interpret magnitude and ranking to conclude: ""r.elevation emerged as the most predictive in %IncMSE, with high values in %IncMSE (~20%) and IncNodePurity (~0.9 × 10-4), highlighting its relevance in predicting the 87 Sr/ 86 Sr ratio."" They then use this ranking to explain geological controls: ""For this reason, elevation becomes a predictive variable because it indirectly differentiates the type of sediments: fluvial and marine deposits of the Paraná Delta and the elevated plains with loessic/continental deposits."" The disagreement between %IncMSE and IncNodePurity for r.dust (~15% permutation vs ~0.2 × 10-4 impurity) is not investigated and suggests potential non-linear effects or interactions where impurity bias operates. While permutation importance provides partial corroboration, the paper lacks SHAP, PDP/ALE, or conditional importance validation to confirm that importance rankings reflect actual variable effects rather than bias artifacts, especially given the presence of mixed-type features with scale mismatches and skewed distributions."
W3198579878,none,,unclear,Fully automated detection of paramagnetic rims in multiple sclerosis lesions on 3T susceptibility-based MR imaging,10.1016/j.nicl.2021.102796,"The paper explicitly computes variable importance as ""the percent increase in mean-squared error for a model with the variable over a model with a permuted version of that variable, scaled for comparability across variables"" (Methods 2.7) and reports: ""The random forest identified uniformity, entropy, and energy as the most important radiomic features for classifying lesions."" It then interprets rankings: ""The radiomic features that were the most important in this context aimed to measure the variability of intensity within a lesion (entropy and uniformity) or quantify the magnitudes of the intensities themselves (energy)"" (Discussion). These conclusions about which features ""are most important"" and why they matter biologically are drawn from impurity importance without corroboration via permutation importance, SHAP, PDP/ALE, conditional importance, or held-out validation."
W2794772181,none,none,mixed_types|skewed|high_cardinality,Global mapping of potential natural vegetation: an assessment of machine learning algorithms for estimating land potential,10.7717/peerj.5457,"The conclusions state findings explicitly based on importance ranking: ""the most important predictors being total annual precipitation, monthly temperatures, and bioclimatic layers"" and ""Precipitation, temperature maps, and bioclimatic images are consistently the most important covariates in all three case studies."" The paper also ranks predictors (""top 20 most important"") and interprets magnitude (""decline in variable importance was gradual""). Corroboration is limited to cross-validation accuracy and ecological plausibility arguments; the paper provides no permutation, SHAP, PDP/ALE, conditional, or held-out validation of importance rankings."
W3168330745,none,heldout_validation,high_cardinality|mixed_types,SARS-CoV-2 detection status associates with bacterial community composition in patients and the hospital environment,10.1186/s40168-021-01083-0,"""The paper states: 'the importance of each ASV for the prediction performance of the four classifiers...was estimated by the built-in random forest scores in the 100-fold cross-validation. For each body site or environmental site, we finally ranked all ASVs by their average ranking of importance scores.' The main contribution is identifying 'the top 100 ranked important ASV's' and reporting 'One ASV with an exact match to Rothia dentocariosa...was highly ranked as predictive across all four disparate sample types' and 'ASVs from the genera Actinomyces, Anaerococcus, Dialister, Gemella, and Schaalia were in the top 40 ranked predictive features.' These rankings drive their biological conclusions about which taxa are most associated with SARS-CoV-2."""
W3158546184,none,heldout_validation,mixed_types|high_cardinality|skewed,A comparative study of forest methods for time-to-event data: variable selection and predictive performance,10.1186/s12874-021-01386-8,"The paper evaluates variable selection performance by ""frequency of ranking top of the variable importance measures of the correct variables"" and concludes ""MSR-RF and CIF have higher selection rates"" than RSF, with ""MSR-RF possess practical value and is well worth popularizing."" However, the authors themselves observe that ""higher correct variable selection frequency does not match better IBS or c-index value exactly in simulation study,"" indicating VIM-based ranking does not correlate with predictive validity. No permutation importance, SHAP, or conditional importance corroboration is provided, leaving method-ranking conclusions vulnerable to impurity-importance bias, especially for RSF which the paper acknowledges exhibits ""selection bias towards covariates with more possible split points."""
W2957116182,none,heldout_validation,mixed_types|high_cardinality|skewed,Predicting drug activity against cancer cells by random forest models based on minimal genomic information and chemical properties,10.1371/journal.pone.0219774,"The paper identifies top oncogenes by ranking Gini impurity indices: ""The four oncogenes whose mutational statuses are the most important variables...are TP53, BRAF, MYC, and CREBBP, which have Gini impurity indices of 108, 105, 96, and 86"" and selects features based on this ranking without permutation or SHAP validation of importance ranking. Although model performance is validated through cross-validation and the identified genes show biological plausibility, the magnitude and ranking of impurity importance are not corroborated by alternative importance methods."
W4285729222,none,heldout_validation,mixed_types|high_cardinality|skewed,Human Activity Changes During COVID‐19 Lockdown in China—A View From Nighttime Light,10.1029/2021gh000555,"The paper uses feature contributions from random forest models and explicitly interprets magnitude and ranking: ""For each of the six categories, the contribution of the sample to the target value was calculated, and then medians of feature contributions as a proxy for the 'standard level' of variable contributions were obtained with higher absolute values indicating a larger contribution."" The entire Discussion (4.1) depends on interpreting these magnitudes to explain city-specific patterns: ""For Beijing (Figure 6a), the contribution of the company gradually declined from stage I to IV and recovered in stage V."" No permutation importance, SHAP, or conditional importance validation exists; OOB validation only checks overall fit (R² ~0.52), not feature-ranking robustness. Conclusions state ""companies in all cities were resuscitated during stationary period, but Guangzhou's recovery was earlier"" - a ranking claim unsupported by alternative importance methods."
W4224278670,none,none,mixed_types|high_cardinality|skewed,The current status and shortcomings of stereotactic radiosurgery,10.1093/noajnl/vdac058,"""Random forest modeling identified the size of the field as the most important factor for passing or failing followed by algorithm"" and ""collimator was found to be among the least important parameters in predicting phantom performance."" The paper concludes ""Field size had the largest impact in determining performance"" and recommends treatment parameters needing ""particular attention...include smaller field sizes and pencil beam algorithms,"" making the importance ranking the basis for clinical guidance. The authors note field size and collimator correlate (cone collimators used for majority of small fields), yet attribute the effect to field size as ""the driving force,"" which is vulnerable to impurity-importance bias that favors continuous over categorical variables."
W4206807535,none,none,mixed_types|high_cardinality|skewed|scale_mismatch,Machine Learning Applied to Omics Datasets Predicts Mortality in Patients with Alcoholic Hepatitis,10.3390/metabo12010041,"The paper uses random forest feature importance to ""select variables with the top 11 average feature importance in each multi-omics data"" (Section 2.2) and interprets biological meaning from rankings: ""Among the selected bacteria and metabolic pathways used for the 30-day mortality prediction, 6 pathways were related to purine nucleoside biosynthesis. Nucleotide biosynthesis has been reported to be critical for the growth of bacteria in human blood."" No corroboration via permutation, SHAP, PDP/ALE, or conditional importance is provided, and the heterogeneous omics data (529 bacterial species, 472 pathways, 287 lipids, plus metabolites and clinical labs with different scales and distributions) amplifies impurity-importance bias risk."
W4404738023,none,none,mixed_types,Soil carbon in the world’s tidal marshes,10.1038/s41467-024-54572-9,"The paper explicitly states: ""Within the final random forest, variable importance was set to 'impurity' within the ranger package, corresponding to the Gini index for classification."" It interprets both ranking and magnitude: ""Soil depth was the most important driver of SOC density"" and ""temperature (both maximum and minimum) had similar relative variable importance as many other covariates."" The authors acknowledge a key limitation: ""While the variable importance of the model indicates that temperatures partially drive the patterns of SOC, there is uncertainty in this assessment as underlying interactions between variables are not captured."" No permutation importance, SHAP, partial dependence, conditional importance, or held-out validation is used to corroborate these rankings."
W3048313323,none,none,skewed,VariantSpark: Cloud-based machine learning for association study of complex phenotype and large-scale genomic data,10.1093/gigascience/giaa077,"The paper ranks genomic variants by Gini-impurity importance scores and claims VariantSpark ""outperforms LR for epistatic and complex phenotypes,"" achieving detection rates ""up to 4.6 times higher than LR."" These substantive conclusions rest entirely on importance ranking (top-k variant recovery), with no permutation importance, SHAP, PDP/ALE, conditional importance, or held-out validation to corroborate the ranking. The ranking-based findings are central to the paper's core message about VariantSpark's superiority."
W4289224932,none,heldout_validation,mixed_types|scale_mismatch|skewed,Global analysis and prediction of fluoride in groundwater,10.1038/s41467-022-31940-x,"The Methods section states importance was ""determined as the mean decrease of the Gini index (classification impurity)"" and the paper concludes ""The geospatial prediction model is dominated by climate parameters"" based explicitly on Gini rankings in Fig. 2a. While univariate Kendall correlations in Fig. 2b show relationships between individual predictors and fluoride prevalence, no permutation importance, SHAP, PDP/ALE, or conditional importance methods are employed to validate the importance magnitude or ranking. The authors acknowledge the bias directly: ""a categorical variable (such as lithology) is less likely than a continuous variable to have an effect on the model when its values are randomly sorted, due to having far fewer possible values,"" yet implement no correction. The predictor set mixes continuous (climate, topography, soil at 250m-1km resolution) and categorical (acidic igneous rocks) variables with inherently different cardinalities, creating conditions for impurity importance to magnify effects on high-cardinality continuous features."
W3126841944,none,none,high_cardinality|skewed,kernInt: A Kernel Framework for Integrating Supervised and Unsupervised Analyses in Spatio-Temporal Metagenomic Datasets,10.3389/fmicb.2021.609048,"Paper explicitly uses mean decrease in node impurity and mean decrease Gini for RF feature importance. Authors interpret biological drivers from feature ranking: soil data show ""prediction is primarily driven by few OTUs of extreme pH ecosystems (e.g., genera Rubrobacter and Balneimonas)""; pig data note ""great importance given by cLin to Desulfovibrio."" No permutation importance, SHAP, PDP/ALE, conditional importance, or held-out predictive validation of feature ranking is provided to corroborate these importance magnitude and ranking claims."
W2883457117,none,,mixed_types|skewed,Using machine learning to guide targeted and locally-tailored empiric antibiotic prescribing in a children's hospital in Cambodia,10.12688/wellcomeopenres.14847.1,"The abstract states: ""Most important variables for predicting susceptibility were time from admission to blood culture, patient age, hospital versus community-acquired infection, and age-adjusted weight score."" Figure 5 reports that ""the most important predictor for resistance to ceftriaxone is patient age (leaving this out would decrease the model accuracy 100% of the time). Patient age is closely followed by days from hospital admission to blood sample, age-adjusted weight score, and the classification of the infection as hospital- or community-acquired (omitting this variable would decrease model accuracy 75% of the time)."" The paper uses ranger package random forests (default impurity-based importance), cites Janitza et al. for methodology, but reports no p-values or significance tests for importance scores. No corroboration via permutation importance, SHAP, PDP/ALE, conditional importance, or held-out validation is provided. The ""days from admission"" variable has exponential distribution (Table 1), making it susceptible to upward-biased impurity importance."
W4412136488,none,none,mixed_types,Haemosporidian Infection Risk Variation Across an Urban Gradient in a Songbird,10.1002/ece3.71770,"The paper identifies significant predictors using Gini importance thresholds: ""The predictor variables were considered significant only if they exceeded the absolute values of the variable with the lowest Gini impurity."" Three variables are ranked by importance magnitude (wing chord 0.494 > trash 0.38 > tables 0.375) and interpreted as ""the most significant variables for predicting infection risk."" The core conclusion states: ""biotic factors—rather than abiotic environmental conditions—may play a more significant role in increasing infection risk."" No independent validation method (permutation, SHAP, PDP/ALE, conditional importance) corroborates these importance rankings."
